<!ELEMENT GROUP (NAME, PLACEOFBIRTH, COURSE, FAVOURITEMODULE, HOBBIES)>
<!ELEMENT NAME (#PCDATA)>
<!ELEMENT PLACEOFBIRTH (#PCDATA)>
<!ELEMENT COURSE (#PCDATA)>
<!ELEMENT FAVOURITEMODULE (#PCDATA)>
<!ELEMENT HOBBIES (#PCDATA)>